producto,precio
Agua Mineral Nestle 500 cc,"$ 47,68   por 1 unidad/es"
Agua Saborizada AQUARIUS Naranja Botella 1.5 L,"$ 140,80   por 1 unidad/es"
Agua Saborizada AQUARIUS Pomelo Botella 1.5 L,"$ 127,52   por 1 unidad/es"
Agua Saborizada AQUARIUS Pomelo Botella 500 Cc,"$ 49,33   por 1 unidad/es"
Agua Saborizada AWAFRUT Manzana Botella 1.65 Lt.,"$ 79,24   por 1 unidad/es"
Agua Saborizada Aquarius Pera Botella 1.5 L,"$ 140,80   por 1 unidad/es"
Agua Saborizada H2oh! Citrus 2.25 Lt.,"$ 148,59   por 1 unidad/es"
Agua Saborizada H2oh! Naranchelo 2.25 Lt.,"$ 148,59   por 1 unidad/es"
Agua Valle Asunción x 3000 Cc. x 1 U.,"$ 65,02   por 1 unidad/es"
Agua Valle Asunción x 3000 Cc. x 6 U.,"$ 350,15   por 1 unidad/es"
Agua mineral Nestle Bidón 6.3 lt,"$ 158,90   por 1 unidad/es"
Agua saborizada AWAFRUT Naranja-Durazno Botella 1.65 Lt.,"$ 79,24   por 1 unidad/es"
"Six Pack Aquarius Naranja 1,5 Lt.","$ 591,36   por 1 unidad/es $ 844,80 30 %"
"Six Pack Aquarius Pera 1, 5 Lt.","$ 591,36   por 1 unidad/es $ 844,80 30 %"
"Six Pack Aquarius Pomelo 1,5 Lt.","$ 535,58   por 1 unidad/es $ 765,12 30 %"
Six Pack Soda Kin 2250 Ml.,"$ 372,96   por 1 unidad/es $ 532,80 30 %"
Soda Kin 2.25 lt,"$ 88,80   por 1 unidad/es"
Soda Sifón Valle Asunción x 2000 Cc. x 1 U.,"$ 70,01   por 1 unidad/es"
Soda Sifón Valle Asunción x 2000 Cc. x 6 U.,"$ 370,00   por 1 unidad/es"
