producto,precio
Bimbo Pan Blanco Liviano 400 Gr.,"$ 150,96   por 1 unidad/es"
Bimbo Pan de Hamburguesa con semillas de sésamo 4 u.,"$ 108,80   por 1 unidad/es"
Bimbo Pan para Pancho 6 u.,"$ 108,80   por 1 unidad/es"
Bimbo Pan tipo Artesano 400gr,"$ 195,50   por 1 unidad/es"
Bimbo Rapiditas Clasicas 10 u.,"$ 125,55   por 1 unidad/es"
Flan Godet sabor Dulce de Leche 30 gr.,"$ 32,24   por 1 unidad/es"
Flan Godet sabor vainilla 30 Gr,"$ 32,24   por 1 unidad/es"
Flan de Vainilla Exquisita Cja 60 Gr,"$ 45,14   por 1 unidad/es"
Gelatina Godet sabor Cereza 30gr,"$ 43,66   por 1 unidad/es"
Gelatina Light de Frutilla Exquisita Cja 25 Gr,"$ 60,49   por 1 unidad/es"
Gelatina de Durazno Exquisita Cja 40 Gr,"$ 53,21   por 1 unidad/es"
Gelatina de Frutilla Exquisita Cja 40 Gr,"$ 53,07   por 1 unidad/es"
Harina Favorita 000 paquete de 1 kg,"$ 68,97   por 1 unidad/es"
Harina Pureza 0000 para todos los usos 1Kg.,"$ 65,44   por 1 unidad/es"
Harina Pureza Especial para Pizzas Caseras con levadura 1Kg.,"$ 110,91   por 1 unidad/es"
Harina Pureza Integral 1 Kg.,"$ 101,50   por 1 unidad/es"
Harina Pureza Leudante 0% sodio Sin Sal agregada 1 Kg.,"$ 91,18   por 1 unidad/es"
Harina Pureza Leudante ultra Refinada Repostería Casera 1 Kg.,"$ 92,49   por 1 unidad/es"
Harina leudante Blancaflor por 1 kg.,"$ 88,80   por 1 unidad/es"
Pan Oroweat Cereales 600 Gr.,"$ 283,65   por 1 unidad/es"
Pan Rallado Preferido 500 gr,"$ 82,29   por 1 unidad/es"
Polenta La Egipciana 500 gr,"$ 72,95   por 1 unidad/es"
Polenta Prestopronta 500 gr.,"$ 83,77   por 1 unidad/es"
Postre de Vainilla Exquisita Cja 80 Gr,"$ 53,98   por 1 unidad/es"
Postre sabor Chocolate Godet 70 Gr,"$ 46,06   por 1 unidad/es"
Premezcla Lucchetti Chipá 250 gr,"$ 166,78   por 1 unidad/es"
Premezcla Lucchetti Ñoquis 400 gr,"$ 134,01   por 1 unidad/es"
Premezcla Lucchetti Pizza 500 gr,"$ 101,48   por 1 unidad/es"
Preparado Para Brownies AGUILA Chocolate 425 Gr,"$ 168,93   por 1 unidad/es"
Preparado para Bizcochuelo Marmolado Godet 500 gr.,"$ 116,40   por 1 unidad/es"
Preparado para Bizcochuelo de Chocolate Exquisita Cja 540 Gr,"$ 166,37   por 1 unidad/es"
Preparado para Bizcochuelo de Chocolate s/TACC Maizena,"$ 185,59   por 1 unidad/es"
Preparado para Bizcochuelo de Vainilla Aguila Cja 540 Gr,"$ 166,98   por 1 unidad/es"
Preparado para Bizcochuelo de Vainilla Exquisita Cja 540 Gr,"$ 134,13   por 1 unidad/es"
Preparado para Bizcochuelo de Vainilla s/TACC Maizena,"$ 173,68   por 1 unidad/es"
Preparado para Brownies de Chocolate Exquisita Cja 425 Gr,"$ 176,92   por 1 unidad/es"
Preparado para Torta Húmeda de Chocolate AGUILA 450 Gr.,"$ 166,68   por 1 unidad/es"
Puré de Papas Maggi 200 gr,"$ 125,78   por 1 unidad/es"
Puré de papas Maggi x 125 gr,"$ 79,25   por 1 unidad/es"
Rebozador Preferido 500 gr,"$ 84,73   por 1 unidad/es"
Vitina Clásica 250 gr,"$ 85,47   por 1 unidad/es"
Vitina Clásica 500 gr,"$ 149,63   por 1 unidad/es"
